Sheet: dragonquest
A1: boss等级 | B1: boss生命值 | C1: 阶段1开始生命值 | D1: 阶段2开始生命值 | E1: 阶段3开始生命值 | F1: boss总奖励金钱 | G1: boss总奖励声望 | J1: 阶段1生命值开始比例 | K1: 阶段2生命值开始比例 | L1: 阶段3生命值开始比例
A2: 1 | B2: 100000 | C2: =INT(RC[-1]*R2C10) -> 100000 | D2: =INT(RC[-2]*R2C11) -> 80000 | E2: =INT(RC[-3]*R2C12) -> 30000 | F2: 40000 | G2: 50000 | J2: 1 | K2: 0.8 | L2: 0.3
A3: 2 | B3: 100100 | C3: =INT(RC[-1]*R2C10) -> 100100 | D3: =INT(RC[-2]*R2C11) -> 80080 | E3: =INT(RC[-3]*R2C12) -> 30030 | F3: =ROUNDUP(R[-1]C*1.08,0) -> 43200 | G3: 60000
A4: 3 | B4: 100200 | C4: =INT(RC[-1]*R2C10) -> 100200 | D4: =INT(RC[-2]*R2C11) -> 80160 | E4: =INT(RC[-3]*R2C12) -> 30060 | F4: =ROUNDUP(R[-1]C*1.08,0) -> 46656 | G4: 70000
A5: 4 | B5: 100300 | C5: =INT(RC[-1]*R2C10) -> 100300 | D5: =INT(RC[-2]*R2C11) -> 80240 | E5: =INT(RC[-3]*R2C12) -> 30090 | F5: =ROUNDUP(R[-1]C*1.08,0) -> 50389 | G5: 80000
A6: 5 | B6: 100400 | C6: =INT(RC[-1]*R2C10) -> 100400 | D6: =INT(RC[-2]*R2C11) -> 80320 | E6: =INT(RC[-3]*R2C12) -> 30120 | F6: =ROUNDUP(R[-1]C*1.08,0) -> 54421 | G6: 90000
A7: 6 | B7: 100500 | C7: =INT(RC[-1]*R2C10) -> 100500 | D7: =INT(RC[-2]*R2C11) -> 80400 | E7: =INT(RC[-3]*R2C12) -> 30150 | F7: =ROUNDUP(R[-1]C*1.08,0) -> 58775 | G7: 100000
A8: 7 | B8: 100600 | C8: =INT(RC[-1]*R2C10) -> 100600 | D8: =INT(RC[-2]*R2C11) -> 80480 | E8: =INT(RC[-3]*R2C12) -> 30180 | F8: =ROUNDUP(R[-1]C*1.08,0) -> 63477 | G8: 110000
A9: 8 | B9: 100700 | C9: =INT(RC[-1]*R2C10) -> 100700 | D9: =INT(RC[-2]*R2C11) -> 80560 | E9: =INT(RC[-3]*R2C12) -> 30210 | F9: =ROUNDUP(R[-1]C*1.08,0) -> 68556 | G9: 120000
A10: 9 | B10: 100800 | C10: =INT(RC[-1]*R2C10) -> 100800 | D10: =INT(RC[-2]*R2C11) -> 80640 | E10: =INT(RC[-3]*R2C12) -> 30240 | F10: =ROUNDUP(R[-1]C*1.08,0) -> 74041 | G10: 130000
A11: 10 | B11: 100900 | C11: =INT(RC[-1]*R2C10) -> 100900 | D11: =INT(RC[-2]*R2C11) -> 80720 | E11: =INT(RC[-3]*R2C12) -> 30270 | F11: =ROUNDUP(R[-1]C*1.08,0) -> 79965 | G11: 140000
A12: 11 | B12: 101000 | C12: =INT(RC[-1]*R2C10) -> 101000 | D12: =INT(RC[-2]*R2C11) -> 80800 | E12: =INT(RC[-3]*R2C12) -> 30300 | F12: =ROUNDUP(R[-1]C*1.08,0) -> 86363 | G12: 150000
A13: 12 | B13: 101100 | C13: =INT(RC[-1]*R2C10) -> 101100 | D13: =INT(RC[-2]*R2C11) -> 80880 | E13: =INT(RC[-3]*R2C12) -> 30330 | F13: =ROUNDUP(R[-1]C*1.08,0) -> 93273 | G13: 160000
A14: 13 | B14: 101200 | C14: =INT(RC[-1]*R2C10) -> 101200 | D14: =INT(RC[-2]*R2C11) -> 80960 | E14: =INT(RC[-3]*R2C12) -> 30360 | F14: =ROUNDUP(R[-1]C*1.08,0) -> 100735 | G14: 170000
A15: 14 | B15: 101300 | C15: =INT(RC[-1]*R2C10) -> 101300 | D15: =INT(RC[-2]*R2C11) -> 81040 | E15: =INT(RC[-3]*R2C12) -> 30390 | F15: =ROUNDUP(R[-1]C*1.08,0) -> 108794 | G15: 180000
A16: 15 | B16: 101400 | C16: =INT(RC[-1]*R2C10) -> 101400 | D16: =INT(RC[-2]*R2C11) -> 81120 | E16: =INT(RC[-3]*R2C12) -> 30420 | F16: =ROUNDUP(R[-1]C*1.08,0) -> 117498 | G16: 190000
A17: 16 | B17: 101500 | C17: =INT(RC[-1]*R2C10) -> 101500 | D17: =INT(RC[-2]*R2C11) -> 81200 | E17: =INT(RC[-3]*R2C12) -> 30450 | F17: =ROUNDUP(R[-1]C*1.08,0) -> 126898 | G17: 200000
A18: 17 | B18: 101600 | C18: =INT(RC[-1]*R2C10) -> 101600 | D18: =INT(RC[-2]*R2C11) -> 81280 | E18: =INT(RC[-3]*R2C12) -> 30480 | F18: =ROUNDUP(R[-1]C*1.08,0) -> 137050 | G18: 210000
A19: 18 | B19: 101700 | C19: =INT(RC[-1]*R2C10) -> 101700 | D19: =INT(RC[-2]*R2C11) -> 81360 | E19: =INT(RC[-3]*R2C12) -> 30510 | F19: =ROUNDUP(R[-1]C*1.08,0) -> 148014 | G19: 220000
A20: 19 | B20: 101800 | C20: =INT(RC[-1]*R2C10) -> 101800 | D20: =INT(RC[-2]*R2C11) -> 81440 | E20: =INT(RC[-3]*R2C12) -> 30540 | F20: =ROUNDUP(R[-1]C*1.08,0) -> 159856 | G20: 230000
A21: 20 | B21: 101900 | C21: =INT(RC[-1]*R2C10) -> 101900 | D21: =INT(RC[-2]*R2C11) -> 81520 | E21: =INT(RC[-3]*R2C12) -> 30570 | F21: =ROUNDUP(R[-1]C*1.08,0) -> 172645 | G21: 240000
A22: 21 | B22: 102000 | C22: =INT(RC[-1]*R2C10) -> 102000 | D22: =INT(RC[-2]*R2C11) -> 81600 | E22: =INT(RC[-3]*R2C12) -> 30600 | F22: =ROUNDUP(R[-1]C*1.08,0) -> 186457 | G22: 250000
A23: 22 | B23: 102100 | C23: =INT(RC[-1]*R2C10) -> 102100 | D23: =INT(RC[-2]*R2C11) -> 81680 | E23: =INT(RC[-3]*R2C12) -> 30630 | F23: =ROUNDUP(R[-1]C*1.08,0) -> 201374 | G23: 260000
A24: 23 | B24: 102200 | C24: =INT(RC[-1]*R2C10) -> 102200 | D24: =INT(RC[-2]*R2C11) -> 81760 | E24: =INT(RC[-3]*R2C12) -> 30660 | F24: =ROUNDUP(R[-1]C*1.08,0) -> 217484 | G24: 270000

Sheet: dragonquestphase1
A1: boss等级 | B1: boss第一阶段动画id | C1: 部位1动画id | D1: 部位1武力 | E1: 部位1智力 | F1: 部位1物防 | G1: 部位1法防 | H1: 部位技能id | I1: 部位2动画id | J1: 部位2武力 | K1: 部位2智力 | L1: 部位2物防 | M1: 部位2法防 | N1: 部位2技能id | R1: 部位1武力 | S1: 部位1智力 | T1: 部位1物防 | U1: 部位1法防 | V1: 难度倍率 | X1: 部位2武力 | Y1: 部位2智力 | Z1: 部位2物防 | AA1: 部位2法防 | AB1: 难度倍率
A2: 1 | B2: 100000 | C2: 10002 | D2: =#N/A -> 100 | E2: =#N/A -> 112 | F2: =#N/A -> 100 | G2: =#N/A -> 112 | H2: 1001 | I2: 10003 | J2: =RC[14]*R2C28 -> 100 | K2: =RC[14]*R2C28 -> 112 | L2: =RC[14]*R2C28 -> 100 | M2: =RC[14]*R2C28 -> 112 | N2: 1001 | R2: =100 -> 100 | S2: =RC[-1]+12 -> 112 | T2: 100 | U2: =RC[-1]+12 -> 112 | V2: 1 | X2: 100 | Y2: =RC[-1]+12 -> 112 | Z2: 100 | AA2: =RC[-1]+12 -> 112 | AB2: 1
A3: 2 | B3: 100000 | C3: 10002 | D3: =RC[14]*R2C22 -> 110 | E3: =RC[14]*R2C22 -> 122 | F3: =RC[14]*R2C22 -> 110 | G3: =RC[14]*R2C22 -> 122 | H3: 1002 | I3: 10003 | J3: =RC[14]*R2C28 -> 110 | K3: =RC[14]*R2C28 -> 122 | L3: =RC[14]*R2C28 -> 110 | M3: =RC[14]*R2C28 -> 122 | N3: 1002 | R3: 110 | S3: =RC[-1]+12 -> 122 | T3: 110 | U3: =RC[-1]+12 -> 122 | V3: 1 | X3: 110 | Y3: =RC[-1]+12 -> 122 | Z3: 110 | AA3: =RC[-1]+12 -> 122 | AB3: 1
A4: 3 | B4: 100000 | C4: 10002 | D4: =RC[14]*R2C22 -> 120 | E4: =RC[14]*R2C22 -> 132 | F4: =RC[14]*R2C22 -> 120 | G4: =RC[14]*R2C22 -> 132 | H4: 1003 | I4: 10003 | J4: =RC[14]*R2C28 -> 120 | K4: =RC[14]*R2C28 -> 132 | L4: =RC[14]*R2C28 -> 120 | M4: =RC[14]*R2C28 -> 132 | N4: 1003 | R4: 120 | S4: =RC[-1]+12 -> 132 | T4: 120 | U4: =RC[-1]+12 -> 132 | V4: 1 | X4: 120 | Y4: =RC[-1]+12 -> 132 | Z4: 120 | AA4: =RC[-1]+12 -> 132 | AB4: 1
A5: 4 | B5: 100000 | C5: 10002 | D5: =RC[14]*R2C22 -> 130 | E5: =RC[14]*R2C22 -> 142 | F5: =RC[14]*R2C22 -> 130 | G5: =RC[14]*R2C22 -> 142 | H5: 1004 | I5: 10003 | J5: =RC[14]*R2C28 -> 130 | K5: =RC[14]*R2C28 -> 142 | L5: =RC[14]*R2C28 -> 130 | M5: =RC[14]*R2C28 -> 142 | N5: 1004 | R5: 130 | S5: =RC[-1]+12 -> 142 | T5: 130 | U5: =RC[-1]+12 -> 142 | V5: 1 | X5: 130 | Y5: =RC[-1]+12 -> 142 | Z5: 130 | AA5: =RC[-1]+12 -> 142 | AB5: 1
A6: 5 | B6: 100000 | C6: 10002 | D6: =RC[14]*R2C22 -> 140 | E6: =RC[14]*R2C22 -> 152 | F6: =RC[14]*R2C22 -> 140 | G6: =RC[14]*R2C22 -> 152 | H6: 1005 | I6: 10003 | J6: =RC[14]*R2C28 -> 140 | K6: =RC[14]*R2C28 -> 152 | L6: =RC[14]*R2C28 -> 140 | M6: =RC[14]*R2C28 -> 152 | N6: 1005 | R6: 140 | S6: =RC[-1]+12 -> 152 | T6: 140 | U6: =RC[-1]+12 -> 152 | V6: 1 | X6: 140 | Y6: =RC[-1]+12 -> 152 | Z6: 140 | AA6: =RC[-1]+12 -> 152 | AB6: 1
A7: 6 | B7: 100000 | C7: 10002 | D7: =RC[14]*R2C22 -> 150 | E7: =RC[14]*R2C22 -> 162 | F7: =RC[14]*R2C22 -> 150 | G7: =RC[14]*R2C22 -> 162 | H7: 1006 | I7: 10003 | J7: =RC[14]*R2C28 -> 150 | K7: =RC[14]*R2C28 -> 162 | L7: =RC[14]*R2C28 -> 150 | M7: =RC[14]*R2C28 -> 162 | N7: 1006 | R7: 150 | S7: =RC[-1]+12 -> 162 | T7: 150 | U7: =RC[-1]+12 -> 162 | V7: 1 | X7: 150 | Y7: =RC[-1]+12 -> 162 | Z7: 150 | AA7: =RC[-1]+12 -> 162 | AB7: 1
A8: 7 | B8: 100000 | C8: 10002 | D8: =RC[14]*R2C22 -> 160 | E8: =RC[14]*R2C22 -> 172 | F8: =RC[14]*R2C22 -> 160 | G8: =RC[14]*R2C22 -> 172 | H8: 1007 | I8: 10003 | J8: =RC[14]*R2C28 -> 160 | K8: =RC[14]*R2C28 -> 172 | L8: =RC[14]*R2C28 -> 160 | M8: =RC[14]*R2C28 -> 172 | N8: 1007 | R8: 160 | S8: =RC[-1]+12 -> 172 | T8: 160 | U8: =RC[-1]+12 -> 172 | V8: 1 | X8: 160 | Y8: =RC[-1]+12 -> 172 | Z8: 160 | AA8: =RC[-1]+12 -> 172 | AB8: 1
A9: 8 | B9: 100000 | C9: 10002 | D9: =RC[14]*R2C22 -> 170 | E9: =RC[14]*R2C22 -> 182 | F9: =RC[14]*R2C22 -> 170 | G9: =RC[14]*R2C22 -> 182 | H9: 1008 | I9: 10003 | J9: =RC[14]*R2C28 -> 170 | K9: =RC[14]*R2C28 -> 182 | L9: =RC[14]*R2C28 -> 170 | M9: =RC[14]*R2C28 -> 182 | N9: 1008 | R9: 170 | S9: =RC[-1]+12 -> 182 | T9: 170 | U9: =RC[-1]+12 -> 182 | V9: 1 | X9: 170 | Y9: =RC[-1]+12 -> 182 | Z9: 170 | AA9: =RC[-1]+12 -> 182 | AB9: 1
A10: 9 | B10: 100000 | C10: 10002 | D10: =RC[14]*R2C22 -> 180 | E10: =RC[14]*R2C22 -> 192 | F10: =RC[14]*R2C22 -> 180 | G10: =RC[14]*R2C22 -> 192 | H10: 1009 | I10: 10003 | J10: =RC[14]*R2C28 -> 180 | K10: =RC[14]*R2C28 -> 192 | L10: =RC[14]*R2C28 -> 180 | M10: =RC[14]*R2C28 -> 192 | N10: 1009 | R10: 180 | S10: =RC[-1]+12 -> 192 | T10: 180 | U10: =RC[-1]+12 -> 192 | V10: 1 | X10: 180 | Y10: =RC[-1]+12 -> 192 | Z10: 180 | AA10: =RC[-1]+12 -> 192 | AB10: 1
A11: 10 | B11: 100000 | C11: 10002 | D11: =RC[14]*R2C22 -> 190 | E11: =RC[14]*R2C22 -> 202 | F11: =RC[14]*R2C22 -> 190 | G11: =RC[14]*R2C22 -> 202 | H11: 1010 | I11: 10003 | J11: =RC[14]*R2C28 -> 190 | K11: =RC[14]*R2C28 -> 202 | L11: =RC[14]*R2C28 -> 190 | M11: =RC[14]*R2C28 -> 202 | N11: 1010 | R11: 190 | S11: =RC[-1]+12 -> 202 | T11: 190 | U11: =RC[-1]+12 -> 202 | V11: 1 | X11: 190 | Y11: =RC[-1]+12 -> 202 | Z11: 190 | AA11: =RC[-1]+12 -> 202 | AB11: 1
A12: 11 | B12: 100000 | C12: 10002 | D12: =RC[14]*R2C22 -> 200 | E12: =RC[14]*R2C22 -> 212 | F12: =RC[14]*R2C22 -> 200 | G12: =RC[14]*R2C22 -> 212 | H12: 1011 | I12: 10003 | J12: =RC[14]*R2C28 -> 200 | K12: =RC[14]*R2C28 -> 212 | L12: =RC[14]*R2C28 -> 200 | M12: =RC[14]*R2C28 -> 212 | N12: 1011 | R12: 200 | S12: =RC[-1]+12 -> 212 | T12: 200 | U12: =RC[-1]+12 -> 212 | V12: 1 | X12: 200 | Y12: =RC[-1]+12 -> 212 | Z12: 200 | AA12: =RC[-1]+12 -> 212 | AB12: 1
A13: 12 | B13: 100000 | C13: 10002 | D13: =RC[14]*R2C22 -> 210 | E13: =RC[14]*R2C22 -> 222 | F13: =RC[14]*R2C22 -> 210 | G13: =RC[14]*R2C22 -> 222 | H13: 1012 | I13: 10003 | J13: =RC[14]*R2C28 -> 210 | K13: =RC[14]*R2C28 -> 222 | L13: =RC[14]*R2C28 -> 210 | M13: =RC[14]*R2C28 -> 222 | N13: 1012 | R13: 210 | S13: =RC[-1]+12 -> 222 | T13: 210 | U13: =RC[-1]+12 -> 222 | V13: 1 | X13: 210 | Y13: =RC[-1]+12 -> 222 | Z13: 210 | AA13: =RC[-1]+12 -> 222 | AB13: 1
A14: 13 | B14: 100000 | C14: 10002 | D14: =RC[14]*R2C22 -> 220 | E14: =RC[14]*R2C22 -> 232 | F14: =RC[14]*R2C22 -> 220 | G14: =RC[14]*R2C22 -> 232 | H14: 1013 | I14: 10003 | J14: =RC[14]*R2C28 -> 220 | K14: =RC[14]*R2C28 -> 232 | L14: =RC[14]*R2C28 -> 220 | M14: =RC[14]*R2C28 -> 232 | N14: 1013 | R14: 220 | S14: =RC[-1]+12 -> 232 | T14: 220 | U14: =RC[-1]+12 -> 232 | V14: 1 | X14: 220 | Y14: =RC[-1]+12 -> 232 | Z14: 220 | AA14: =RC[-1]+12 -> 232 | AB14: 1
A15: 14 | B15: 100000 | C15: 10002 | D15: =RC[14]*R2C22 -> 230 | E15: =RC[14]*R2C22 -> 242 | F15: =RC[14]*R2C22 -> 230 | G15: =RC[14]*R2C22 -> 242 | H15: 1014 | I15: 10003 | J15: =RC[14]*R2C28 -> 230 | K15: =RC[14]*R2C28 -> 242 | L15: =RC[14]*R2C28 -> 230 | M15: =RC[14]*R2C28 -> 242 | N15: 1014 | R15: 230 | S15: =RC[-1]+12 -> 242 | T15: 230 | U15: =RC[-1]+12 -> 242 | V15: 1 | X15: 230 | Y15: =RC[-1]+12 -> 242 | Z15: 230 | AA15: =RC[-1]+12 -> 242 | AB15: 1
A16: 15 | B16: 100000 | C16: 10002 | D16: =RC[14]*R2C22 -> 240 | E16: =RC[14]*R2C22 -> 252 | F16: =RC[14]*R2C22 -> 240 | G16: =RC[14]*R2C22 -> 252 | H16: 1015 | I16: 10003 | J16: =RC[14]*R2C28 -> 240 | K16: =RC[14]*R2C28 -> 252 | L16: =RC[14]*R2C28 -> 240 | M16: =RC[14]*R2C28 -> 252 | N16: 1015 | R16: 240 | S16: =RC[-1]+12 -> 252 | T16: 240 | U16: =RC[-1]+12 -> 252 | V16: 1 | X16: 240 | Y16: =RC[-1]+12 -> 252 | Z16: 240 | AA16: =RC[-1]+12 -> 252 | AB16: 1
A17: 16 | B17: 100000 | C17: 10002 | D17: =RC[14]*R2C22 -> 250 | E17: =RC[14]*R2C22 -> 262 | F17: =RC[14]*R2C22 -> 250 | G17: =RC[14]*R2C22 -> 262 | H17: 1016 | I17: 10003 | J17: =RC[14]*R2C28 -> 250 | K17: =RC[14]*R2C28 -> 262 | L17: =RC[14]*R2C28 -> 250 | M17: =RC[14]*R2C28 -> 262 | N17: 1016 | R17: 250 | S17: =RC[-1]+12 -> 262 | T17: 250 | U17: =RC[-1]+12 -> 262 | V17: 1 | X17: 250 | Y17: =RC[-1]+12 -> 262 | Z17: 250 | AA17: =RC[-1]+12 -> 262 | AB17: 1
A18: 17 | B18: 100000 | C18: 10002 | D18: =RC[14]*R2C22 -> 260 | E18: =RC[14]*R2C22 -> 272 | F18: =RC[14]*R2C22 -> 260 | G18: =RC[14]*R2C22 -> 272 | H18: 1017 | I18: 10003 | J18: =RC[14]*R2C28 -> 260 | K18: =RC[14]*R2C28 -> 272 | L18: =RC[14]*R2C28 -> 260 | M18: =RC[14]*R2C28 -> 272 | N18: 1017 | R18: 260 | S18: =RC[-1]+12 -> 272 | T18: 260 | U18: =RC[-1]+12 -> 272 | V18: 1 | X18: 260 | Y18: =RC[-1]+12 -> 272 | Z18: 260 | AA18: =RC[-1]+12 -> 272 | AB18: 1
A19: 18 | B19: 100000 | C19: 10002 | D19: =RC[14]*R2C22 -> 270 | E19: =RC[14]*R2C22 -> 282 | F19: =RC[14]*R2C22 -> 270 | G19: =RC[14]*R2C22 -> 282 | H19: 1018 | I19: 10003 | J19: =RC[14]*R2C28 -> 270 | K19: =RC[14]*R2C28 -> 282 | L19: =RC[14]*R2C28 -> 270 | M19: =RC[14]*R2C28 -> 282 | N19: 1018 | R19: 270 | S19: =RC[-1]+12 -> 282 | T19: 270 | U19: =RC[-1]+12 -> 282 | V19: 1 | X19: 270 | Y19: =RC[-1]+12 -> 282 | Z19: 270 | AA19: =RC[-1]+12 -> 282 | AB19: 1
A20: 19 | B20: 100000 | C20: 10002 | D20: =RC[14]*R2C22 -> 280 | E20: =RC[14]*R2C22 -> 292 | F20: =RC[14]*R2C22 -> 280 | G20: =RC[14]*R2C22 -> 292 | H20: 1019 | I20: 10003 | J20: =RC[14]*R2C28 -> 280 | K20: =RC[14]*R2C28 -> 292 | L20: =RC[14]*R2C28 -> 280 | M20: =RC[14]*R2C28 -> 292 | N20: 1019 | R20: 280 | S20: =RC[-1]+12 -> 292 | T20: 280 | U20: =RC[-1]+12 -> 292 | V20: 1 | X20: 280 | Y20: =RC[-1]+12 -> 292 | Z20: 280 | AA20: =RC[-1]+12 -> 292 | AB20: 1
A21: 20 | B21: 100000 | C21: 10002 | D21: =RC[14]*R2C22 -> 290 | E21: =RC[14]*R2C22 -> 302 | F21: =RC[14]*R2C22 -> 290 | G21: =RC[14]*R2C22 -> 302 | H21: 1020 | I21: 10003 | J21: =RC[14]*R2C28 -> 290 | K21: =RC[14]*R2C28 -> 302 | L21: =RC[14]*R2C28 -> 290 | M21: =RC[14]*R2C28 -> 302 | N21: 1020 | R21: 290 | S21: =RC[-1]+12 -> 302 | T21: 290 | U21: =RC[-1]+12 -> 302 | V21: 1 | X21: 290 | Y21: =RC[-1]+12 -> 302 | Z21: 290 | AA21: =RC[-1]+12 -> 302 | AB21: 1
A22: 21 | B22: 100000 | C22: 10002 | D22: =RC[14]*R2C22 -> 300 | E22: =RC[14]*R2C22 -> 312 | F22: =RC[14]*R2C22 -> 300 | G22: =RC[14]*R2C22 -> 312 | H22: 1021 | I22: 10003 | J22: =RC[14]*R2C28 -> 300 | K22: =RC[14]*R2C28 -> 312 | L22: =RC[14]*R2C28 -> 300 | M22: =RC[14]*R2C28 -> 312 | N22: 1021 | R22: 300 | S22: =RC[-1]+12 -> 312 | T22: 300 | U22: =RC[-1]+12 -> 312 | V22: 1 | X22: 300 | Y22: =RC[-1]+12 -> 312 | Z22: 300 | AA22: =RC[-1]+12 -> 312 | AB22: 1
A23: 22 | B23: 100000 | C23: 10002 | D23: =RC[14]*R2C22 -> 310 | E23: =RC[14]*R2C22 -> 322 | F23: =RC[14]*R2C22 -> 310 | G23: =RC[14]*R2C22 -> 322 | H23: 1022 | I23: 10003 | J23: =RC[14]*R2C28 -> 310 | K23: =RC[14]*R2C28 -> 322 | L23: =RC[14]*R2C28 -> 310 | M23: =RC[14]*R2C28 -> 322 | N23: 1022 | R23: 310 | S23: =RC[-1]+12 -> 322 | T23: 310 | U23: =RC[-1]+12 -> 322 | V23: 1 | X23: 310 | Y23: =RC[-1]+12 -> 322 | Z23: 310 | AA23: =RC[-1]+12 -> 322 | AB23: 1
A24: 23 | B24: 100000 | C24: 10002 | D24: =RC[14]*R2C22 -> 320 | E24: =RC[14]*R2C22 -> 332 | F24: =RC[14]*R2C22 -> 320 | G24: =RC[14]*R2C22 -> 332 | H24: 1023 | I24: 10003 | J24: =RC[14]*R2C28 -> 320 | K24: =RC[14]*R2C28 -> 332 | L24: =RC[14]*R2C28 -> 320 | M24: =RC[14]*R2C28 -> 332 | N24: =1023 -> 1023 | R24: 320 | S24: =RC[-1]+12 -> 332 | T24: 320 | U24: =RC[-1]+12 -> 332 | V24: 1 | X24: 320 | Y24: =RC[-1]+12 -> 332 | Z24: 320 | AA24: =RC[-1]+12 -> 332 | AB24: 1

Sheet: dragonquestphase2
A1: boss等级 | B1: 小怪1动画id | C1: 小怪1生命值 | D1: 小怪1武力 | E1: 小怪1智力 | F1: 小怪1物防 | G1: 小怪1法防 | H1: 小怪1技能id | I1: 小怪2动画id | J1: 小怪2生命值 | K1: 小怪2武力 | L1: 小怪2智力 | M1: 小怪2物防 | N1: 小怪2法防 | O1: 小怪2技能id | P1: 战斗失败扣boss血量 | Q1: 战斗胜利扣boss血量 | W1: 小怪生命值 | X1: 小怪武力 | Y1: 小怪智力 | Z1: 小怪物防 | AA1: 小怪法防 | AB1: 难度倍率
A2: 1 | B2: 11001 | C2: =RC[20]*R2C28 -> 100000 | D2: =RC[20]*R2C28 -> 100 | E2: =RC[20]*R2C28 -> 112 | F2: =RC[20]*R2C28 -> 100 | G2: =RC[20]*R2C28 -> 112 | H2: 1001 | I2: 11002 | J2: 100000 | K2: 100 | L2: =RC[-1]+12 -> 112 | M2: 100 | N2: =RC[-1]+12 -> 112 | O2: 1001 | P2: 100 | Q2: 200 | W2: 100000 | X2: 100 | Y2: =RC[-1]+12 -> 112 | Z2: 100 | AA2: =RC[-1]+12 -> 112 | AB2: 1
A3: 2 | B3: 11001 | C3: =RC[20]*R2C28 -> 100100 | D3: =RC[20]*R2C28 -> 110 | E3: =RC[20]*R2C28 -> 122 | F3: =RC[20]*R2C28 -> 110 | G3: =RC[20]*R2C28 -> 122 | H3: 1001 | I3: 11002 | J3: 100100 | K3: 110 | L3: =RC[-1]+12 -> 122 | M3: 110 | N3: =RC[-1]+12 -> 122 | O3: 1001 | P3: 110 | Q3: 220 | W3: 100100 | X3: 110 | Y3: =RC[-1]+12 -> 122 | Z3: 110 | AA3: =RC[-1]+12 -> 122 | AB3: 1
A4: 3 | B4: 11001 | C4: =RC[20]*R2C28 -> 100200 | D4: =RC[20]*R2C28 -> 120 | E4: =RC[20]*R2C28 -> 132 | F4: =RC[20]*R2C28 -> 120 | G4: =RC[20]*R2C28 -> 132 | H4: 1001 | I4: 11002 | J4: 100200 | K4: 120 | L4: =RC[-1]+12 -> 132 | M4: 120 | N4: =RC[-1]+12 -> 132 | O4: 1001 | P4: 120 | Q4: 240 | W4: 100200 | X4: 120 | Y4: =RC[-1]+12 -> 132 | Z4: 120 | AA4: =RC[-1]+12 -> 132 | AB4: 1
A5: 4 | B5: 11001 | C5: =RC[20]*R2C28 -> 100300 | D5: =RC[20]*R2C28 -> 130 | E5: =RC[20]*R2C28 -> 142 | F5: =RC[20]*R2C28 -> 130 | G5: =RC[20]*R2C28 -> 142 | H5: 1001 | I5: 11002 | J5: 100300 | K5: 130 | L5: =RC[-1]+12 -> 142 | M5: 130 | N5: =RC[-1]+12 -> 142 | O5: 1001 | P5: 130 | Q5: 260 | W5: 100300 | X5: 130 | Y5: =RC[-1]+12 -> 142 | Z5: 130 | AA5: =RC[-1]+12 -> 142 | AB5: 1
A6: 5 | B6: 11001 | C6: =RC[20]*R2C28 -> 100400 | D6: =RC[20]*R2C28 -> 140 | E6: =RC[20]*R2C28 -> 152 | F6: =RC[20]*R2C28 -> 140 | G6: =RC[20]*R2C28 -> 152 | H6: 1001 | I6: 11002 | J6: 100400 | K6: 140 | L6: =RC[-1]+12 -> 152 | M6: 140 | N6: =RC[-1]+12 -> 152 | O6: 1001 | P6: 140 | Q6: 280 | W6: 100400 | X6: 140 | Y6: =RC[-1]+12 -> 152 | Z6: 140 | AA6: =RC[-1]+12 -> 152 | AB6: 1
A7: 6 | B7: 11001 | C7: =RC[20]*R2C28 -> 100500 | D7: =RC[20]*R2C28 -> 150 | E7: =RC[20]*R2C28 -> 162 | F7: =RC[20]*R2C28 -> 150 | G7: =RC[20]*R2C28 -> 162 | H7: 1001 | I7: 11002 | J7: 100500 | K7: 150 | L7: =RC[-1]+12 -> 162 | M7: 150 | N7: =RC[-1]+12 -> 162 | O7: 1001 | P7: 150 | Q7: 300 | W7: 100500 | X7: 150 | Y7: =RC[-1]+12 -> 162 | Z7: 150 | AA7: =RC[-1]+12 -> 162 | AB7: 1
A8: 7 | B8: 11001 | C8: =RC[20]*R2C28 -> 100600 | D8: =RC[20]*R2C28 -> 160 | E8: =RC[20]*R2C28 -> 172 | F8: =RC[20]*R2C28 -> 160 | G8: =RC[20]*R2C28 -> 172 | H8: 1001 | I8: 11002 | J8: 100600 | K8: 160 | L8: =RC[-1]+12 -> 172 | M8: 160 | N8: =RC[-1]+12 -> 172 | O8: 1001 | P8: 160 | Q8: 320 | W8: 100600 | X8: 160 | Y8: =RC[-1]+12 -> 172 | Z8: 160 | AA8: =RC[-1]+12 -> 172 | AB8: 1
A9: 8 | B9: 11001 | C9: =RC[20]*R2C28 -> 100700 | D9: =RC[20]*R2C28 -> 170 | E9: =RC[20]*R2C28 -> 182 | F9: =RC[20]*R2C28 -> 170 | G9: =RC[20]*R2C28 -> 182 | H9: 1001 | I9: 11002 | J9: 100700 | K9: 170 | L9: =RC[-1]+12 -> 182 | M9: 170 | N9: =RC[-1]+12 -> 182 | O9: 1001 | P9: 170 | Q9: 340 | W9: 100700 | X9: 170 | Y9: =RC[-1]+12 -> 182 | Z9: 170 | AA9: =RC[-1]+12 -> 182 | AB9: 1
A10: 9 | B10: 11001 | C10: =RC[20]*R2C28 -> 100800 | D10: =RC[20]*R2C28 -> 180 | E10: =RC[20]*R2C28 -> 192 | F10: =RC[20]*R2C28 -> 180 | G10: =RC[20]*R2C28 -> 192 | H10: 1001 | I10: 11002 | J10: 100800 | K10: 180 | L10: =RC[-1]+12 -> 192 | M10: 180 | N10: =RC[-1]+12 -> 192 | O10: 1001 | P10: 180 | Q10: 360 | W10: 100800 | X10: 180 | Y10: =RC[-1]+12 -> 192 | Z10: 180 | AA10: =RC[-1]+12 -> 192 | AB10: 1
A11: 10 | B11: 11001 | C11: =RC[20]*R2C28 -> 100900 | D11: =RC[20]*R2C28 -> 190 | E11: =RC[20]*R2C28 -> 202 | F11: =RC[20]*R2C28 -> 190 | G11: =RC[20]*R2C28 -> 202 | H11: 1001 | I11: 11002 | J11: 100900 | K11: 190 | L11: =RC[-1]+12 -> 202 | M11: 190 | N11: =RC[-1]+12 -> 202 | O11: 1001 | P11: 190 | Q11: 380 | W11: 100900 | X11: 190 | Y11: =RC[-1]+12 -> 202 | Z11: 190 | AA11: =RC[-1]+12 -> 202 | AB11: 1
A12: 11 | B12: 11001 | C12: =RC[20]*R2C28 -> 101000 | D12: =RC[20]*R2C28 -> 200 | E12: =RC[20]*R2C28 -> 212 | F12: =RC[20]*R2C28 -> 200 | G12: =RC[20]*R2C28 -> 212 | H12: 1001 | I12: 11002 | J12: 101000 | K12: 200 | L12: =RC[-1]+12 -> 212 | M12: 200 | N12: =RC[-1]+12 -> 212 | O12: 1001 | P12: 200 | Q12: 400 | W12: 101000 | X12: 200 | Y12: =RC[-1]+12 -> 212 | Z12: 200 | AA12: =RC[-1]+12 -> 212 | AB12: 1
A13: 12 | B13: 11001 | C13: =RC[20]*R2C28 -> 101100 | D13: =RC[20]*R2C28 -> 210 | E13: =RC[20]*R2C28 -> 222 | F13: =RC[20]*R2C28 -> 210 | G13: =RC[20]*R2C28 -> 222 | H13: 1001 | I13: 11002 | J13: 101100 | K13: 210 | L13: =RC[-1]+12 -> 222 | M13: 210 | N13: =RC[-1]+12 -> 222 | O13: 1001 | P13: 210 | Q13: 420 | W13: 101100 | X13: 210 | Y13: =RC[-1]+12 -> 222 | Z13: 210 | AA13: =RC[-1]+12 -> 222 | AB13: 1
A14: 13 | B14: 11001 | C14: =RC[20]*R2C28 -> 101200 | D14: =RC[20]*R2C28 -> 220 | E14: =RC[20]*R2C28 -> 232 | F14: =RC[20]*R2C28 -> 220 | G14: =RC[20]*R2C28 -> 232 | H14: 1001 | I14: 11002 | J14: 101200 | K14: 220 | L14: =RC[-1]+12 -> 232 | M14: 220 | N14: =RC[-1]+12 -> 232 | O14: 1001 | P14: 220 | Q14: 440 | W14: 101200 | X14: 220 | Y14: =RC[-1]+12 -> 232 | Z14: 220 | AA14: =RC[-1]+12 -> 232 | AB14: 1
A15: 14 | B15: 11001 | C15: =RC[20]*R2C28 -> 101300 | D15: =RC[20]*R2C28 -> 230 | E15: =RC[20]*R2C28 -> 242 | F15: =RC[20]*R2C28 -> 230 | G15: =RC[20]*R2C28 -> 242 | H15: 1001 | I15: 11002 | J15: 101300 | K15: 230 | L15: =RC[-1]+12 -> 242 | M15: 230 | N15: =RC[-1]+12 -> 242 | O15: 1001 | P15: 230 | Q15: 460 | W15: 101300 | X15: 230 | Y15: =RC[-1]+12 -> 242 | Z15: 230 | AA15: =RC[-1]+12 -> 242 | AB15: 1
A16: 15 | B16: 11001 | C16: =RC[20]*R2C28 -> 101400 | D16: =RC[20]*R2C28 -> 240 | E16: =RC[20]*R2C28 -> 252 | F16: =RC[20]*R2C28 -> 240 | G16: =RC[20]*R2C28 -> 252 | H16: 1001 | I16: 11002 | J16: 101400 | K16: 240 | L16: =RC[-1]+12 -> 252 | M16: 240 | N16: =RC[-1]+12 -> 252 | O16: 1001 | P16: 240 | Q16: 480 | W16: 101400 | X16: 240 | Y16: =RC[-1]+12 -> 252 | Z16: 240 | AA16: =RC[-1]+12 -> 252 | AB16: 1
A17: 16 | B17: 11001 | C17: =RC[20]*R2C28 -> 101500 | D17: =RC[20]*R2C28 -> 250 | E17: =RC[20]*R2C28 -> 262 | F17: =RC[20]*R2C28 -> 250 | G17: =RC[20]*R2C28 -> 262 | H17: 1001 | I17: 11002 | J17: 101500 | K17: 250 | L17: =RC[-1]+12 -> 262 | M17: 250 | N17: =RC[-1]+12 -> 262 | O17: 1001 | P17: 250 | Q17: 500 | W17: 101500 | X17: 250 | Y17: =RC[-1]+12 -> 262 | Z17: 250 | AA17: =RC[-1]+12 -> 262 | AB17: 1
A18: 17 | B18: 11001 | C18: =RC[20]*R2C28 -> 101600 | D18: =RC[20]*R2C28 -> 260 | E18: =RC[20]*R2C28 -> 272 | F18: =RC[20]*R2C28 -> 260 | G18: =RC[20]*R2C28 -> 272 | H18: 1001 | I18: 11002 | J18: 101600 | K18: 260 | L18: =RC[-1]+12 -> 272 | M18: 260 | N18: =RC[-1]+12 -> 272 | O18: 1001 | P18: 260 | Q18: 520 | W18: 101600 | X18: 260 | Y18: =RC[-1]+12 -> 272 | Z18: 260 | AA18: =RC[-1]+12 -> 272 | AB18: 1
A19: 18 | B19: 11001 | C19: =RC[20]*R2C28 -> 101700 | D19: =RC[20]*R2C28 -> 270 | E19: =RC[20]*R2C28 -> 282 | F19: =RC[20]*R2C28 -> 270 | G19: =RC[20]*R2C28 -> 282 | H19: 1001 | I19: 11002 | J19: 101700 | K19: 270 | L19: =RC[-1]+12 -> 282 | M19: 270 | N19: =RC[-1]+12 -> 282 | O19: 1001 | P19: 270 | Q19: 540 | W19: 101700 | X19: 270 | Y19: =RC[-1]+12 -> 282 | Z19: 270 | AA19: =RC[-1]+12 -> 282 | AB19: 1
A20: 19 | B20: 11001 | C20: =RC[20]*R2C28 -> 101800 | D20: =RC[20]*R2C28 -> 280 | E20: =RC[20]*R2C28 -> 292 | F20: =RC[20]*R2C28 -> 280 | G20: =RC[20]*R2C28 -> 292 | H20: 1001 | I20: 11002 | J20: 101800 | K20: 280 | L20: =RC[-1]+12 -> 292 | M20: 280 | N20: =RC[-1]+12 -> 292 | O20: 1001 | P20: 280 | Q20: 560 | W20: 101800 | X20: 280 | Y20: =RC[-1]+12 -> 292 | Z20: 280 | AA20: =RC[-1]+12 -> 292 | AB20: 1
A21: 20 | B21: 11001 | C21: =RC[20]*R2C28 -> 101900 | D21: =RC[20]*R2C28 -> 290 | E21: =RC[20]*R2C28 -> 302 | F21: =RC[20]*R2C28 -> 290 | G21: =RC[20]*R2C28 -> 302 | H21: 1001 | I21: 11002 | J21: 101900 | K21: 290 | L21: =RC[-1]+12 -> 302 | M21: 290 | N21: =RC[-1]+12 -> 302 | O21: 1001 | P21: 290 | Q21: 580 | W21: 101900 | X21: 290 | Y21: =RC[-1]+12 -> 302 | Z21: 290 | AA21: =RC[-1]+12 -> 302 | AB21: 1
A22: 21 | B22: 11001 | C22: =RC[20]*R2C28 -> 102000 | D22: =RC[20]*R2C28 -> 300 | E22: =RC[20]*R2C28 -> 312 | F22: =RC[20]*R2C28 -> 300 | G22: =RC[20]*R2C28 -> 312 | H22: 1001 | I22: 11002 | J22: 102000 | K22: 300 | L22: =RC[-1]+12 -> 312 | M22: 300 | N22: =RC[-1]+12 -> 312 | O22: 1001 | P22: 300 | Q22: 600 | W22: 102000 | X22: 300 | Y22: =RC[-1]+12 -> 312 | Z22: 300 | AA22: =RC[-1]+12 -> 312 | AB22: 1
A23: 22 | B23: 11001 | C23: =RC[20]*R2C28 -> 102100 | D23: =RC[20]*R2C28 -> 310 | E23: =RC[20]*R2C28 -> 322 | F23: =RC[20]*R2C28 -> 310 | G23: =RC[20]*R2C28 -> 322 | H23: 1001 | I23: 11002 | J23: 102100 | K23: 310 | L23: =RC[-1]+12 -> 322 | M23: 310 | N23: =RC[-1]+12 -> 322 | O23: 1001 | P23: 310 | Q23: 620 | W23: 102100 | X23: 310 | Y23: =RC[-1]+12 -> 322 | Z23: 310 | AA23: =RC[-1]+12 -> 322 | AB23: 1
A24: 23 | B24: 11001 | C24: =RC[20]*R2C28 -> 102200 | D24: =RC[20]*R2C28 -> 320 | E24: =RC[20]*R2C28 -> 332 | F24: =RC[20]*R2C28 -> 320 | G24: =RC[20]*R2C28 -> 332 | H24: 1001 | I24: 11002 | J24: 102200 | K24: 320 | L24: =RC[-1]+12 -> 332 | M24: 320 | N24: =RC[-1]+12 -> 332 | O24: 1001 | P24: 320 | Q24: 640 | W24: 102200 | X24: 320 | Y24: =RC[-1]+12 -> 332 | Z24: 320 | AA24: =RC[-1]+12 -> 332 | AB24: 1
AB25: 1

Sheet: dragonquestphase3
A1: boss等级 | B1: boss第三阶段动画id | C1: 武力 | D1: 智力 | E1: 物防 | F1: 法防 | G1: 技能id | O1: 难度倍率
A2: 1 | B2: 120001 | C2: 100 | D2: =RC[-1]+12 -> 112 | E2: 100 | F2: =RC[-1]+12 -> 112 | G2: 1001 | O2: 1
A3: 2 | B3: 120001 | C3: 110 | D3: =RC[-1]+12 -> 122 | E3: 110 | F3: =RC[-1]+12 -> 122 | G3: 1002 | O3: 1
A4: 3 | B4: 120001 | C4: 120 | D4: =RC[-1]+12 -> 132 | E4: 120 | F4: =RC[-1]+12 -> 132 | G4: 1003 | O4: 1
A5: 4 | B5: 120001 | C5: 130 | D5: =RC[-1]+12 -> 142 | E5: 130 | F5: =RC[-1]+12 -> 142 | G5: 1004 | O5: 1
A6: 5 | B6: 120001 | C6: 140 | D6: =RC[-1]+12 -> 152 | E6: 140 | F6: =RC[-1]+12 -> 152 | G6: 1005 | O6: 1
A7: 6 | B7: 120001 | C7: 150 | D7: =RC[-1]+12 -> 162 | E7: 150 | F7: =RC[-1]+12 -> 162 | G7: 1006 | O7: 1
A8: 7 | B8: 120001 | C8: 160 | D8: =RC[-1]+12 -> 172 | E8: 160 | F8: =RC[-1]+12 -> 172 | G8: 1007 | O8: 1
A9: 8 | B9: 120001 | C9: 170 | D9: =RC[-1]+12 -> 182 | E9: 170 | F9: =RC[-1]+12 -> 182 | G9: 1008 | O9: 1
A10: 9 | B10: 120001 | C10: 180 | D10: =RC[-1]+12 -> 192 | E10: 180 | F10: =RC[-1]+12 -> 192 | G10: 1009 | O10: 1
A11: 10 | B11: 120001 | C11: 190 | D11: =RC[-1]+12 -> 202 | E11: 190 | F11: =RC[-1]+12 -> 202 | G11: 1010 | O11: 1
A12: 11 | B12: 120001 | C12: 200 | D12: =RC[-1]+12 -> 212 | E12: 200 | F12: =RC[-1]+12 -> 212 | G12: 1011 | O12: 1
A13: 12 | B13: 120001 | C13: 210 | D13: =RC[-1]+12 -> 222 | E13: 210 | F13: =RC[-1]+12 -> 222 | G13: 1012 | O13: 1
A14: 13 | B14: 120001 | C14: 220 | D14: =RC[-1]+12 -> 232 | E14: 220 | F14: =RC[-1]+12 -> 232 | G14: 1013 | O14: 1
A15: 14 | B15: 120001 | C15: 230 | D15: =RC[-1]+12 -> 242 | E15: 230 | F15: =RC[-1]+12 -> 242 | G15: 1014 | O15: 1
A16: 15 | B16: 120001 | C16: 240 | D16: =RC[-1]+12 -> 252 | E16: 240 | F16: =RC[-1]+12 -> 252 | G16: 1015 | O16: 1
A17: 16 | B17: 120001 | C17: 250 | D17: =RC[-1]+12 -> 262 | E17: 250 | F17: =RC[-1]+12 -> 262 | G17: 1016 | O17: 1
A18: 17 | B18: 120001 | C18: 260 | D18: =RC[-1]+12 -> 272 | E18: 260 | F18: =RC[-1]+12 -> 272 | G18: 1017 | O18: 1
A19: 18 | B19: 120001 | C19: 270 | D19: =RC[-1]+12 -> 282 | E19: 270 | F19: =RC[-1]+12 -> 282 | G19: 1018 | O19: 1
A20: 19 | B20: 120001 | C20: 280 | D20: =RC[-1]+12 -> 292 | E20: 280 | F20: =RC[-1]+12 -> 292 | G20: 1019 | O20: 1
A21: 20 | B21: 120001 | C21: 290 | D21: =RC[-1]+12 -> 302 | E21: 290 | F21: =RC[-1]+12 -> 302 | G21: 1020 | O21: 1
A22: 21 | B22: 120001 | C22: 300 | D22: =RC[-1]+12 -> 312 | E22: 300 | F22: =RC[-1]+12 -> 312 | G22: 1021 | O22: 1
A23: 22 | B23: 120001 | C23: 310 | D23: =RC[-1]+12 -> 322 | E23: 310 | F23: =RC[-1]+12 -> 322 | G23: 1022 | O23: 1
A24: 23 | B24: 120001 | C24: 320 | D24: =RC[-1]+12 -> 332 | E24: 320 | F24: =RC[-1]+12 -> 332 | G24: 1023 | O24: 1
O25: 1

Sheet: dragonrankreward
A1: 伤害排名 | B1: 声望最高 | C1: 声望最低 | D1: 金钱最高 | E1: 金钱最低 | H1: 排名 | I1: 声望
A2: 0 | B2: 2000 | C2: 2000 | D2: 120000 | E2: 120000
A3: 1 | B3: 1350 | C3: 1350 | D3: 81000 | E3: 81000
A4: 4 | B4: 1200 | C4: 1000 | D4: 72000 | E4: 60000
A5: 9 | B5: 850 | C5: 650 | D5: 51000 | E5: 39000
A6: 19 | B6: 600 | C6: 420 | D6: 36000 | E6: 25200
A7: 100 | B7: 400 | C7: 300 | D7: 24000 | E7: 18000
A8: 300 | B8: 290 | C8: 200 | D8: 17400 | E8: 12000
A9: 500 | B9: 195 | C9: 150 | D9: 11700 | E9: 9000
A10: 1000 | B10: 145 | C10: 100 | D10: 8700 | E10: 6000
A11: 99999 | B11: 98 | C11: 50 | D11: 5880 | E11: 3000