Sheet: exp
A1: 等级 | B1: 1星经验 | C1: 2星经验 | D1: 3星经验 | E1: 4星经验 | F1: 5星经验 | G1: 6星经验 | K1: 等级 | L1: 1星经验 | M1: 2星经验 | N1: 3星经验 | O1: 4星经验 | P1: 5星经验 | Q1: 6星经验
A2: 0 | B2: 0 | C2: 0 | D2: 0 | E2: 0 | F2: 0 | K2: 倍率 | L2: 0.8 | M2: 0.9 | N2: 1 | O2: 1.2 | P2: 1.4 | Q2: 1.6
A3: 1 | B3: =RC4*R2C[10] -> 120 | C3: =RC4*R2C[10] -> 135 | D3: =exp公式!R2C6*((RC[-3])^3)+exp公式!R2C7*((RC[-3])^2)+exp公式!R2C8*((RC[-3]))+exp公式!R2C9 -> 150 | E3: =RC4*R2C[10] -> 180 | F3: =RC4*R2C[10] -> 210 | G3: =RC4*R2C[10] -> 240
A4: 2 | B4: =RC4*R2C[10] -> 360 | C4: =RC4*R2C[10] -> 405 | D4: =exp公式!R2C6*((RC[-3])^3)+exp公式!R2C7*((RC[-3])^2)+exp公式!R2C8*((RC[-3]))+exp公式!R2C9 -> 450 | E4: =RC4*R2C[10] -> 540 | F4: =RC4*R2C[10] -> 630 | G4: =RC4*R2C[10] -> 720
A5: 3 | B5: =RC4*R2C[10] -> 720 | C5: =RC4*R2C[10] -> 810 | D5: =exp公式!R2C6*((RC[-3])^3)+exp公式!R2C7*((RC[-3])^2)+exp公式!R2C8*((RC[-3]))+exp公式!R2C9 -> 900 | E5: =RC4*R2C[10] -> 1080 | F5: =RC4*R2C[10] -> 1260 | G5: =RC4*R2C[10] -> 1440
A6: 4 | B6: =RC4*R2C[10] -> 1200 | C6: =RC4*R2C[10] -> 1350 | D6: =exp公式!R2C6*((RC[-3])^3)+exp公式!R2C7*((RC[-3])^2)+exp公式!R2C8*((RC[-3]))+exp公式!R2C9 -> 1500 | E6: =RC4*R2C[10] -> 1800 | F6: =RC4*R2C[10] -> 2100 | G6: =RC4*R2C[10] -> 2400
A7: 5 | B7: =RC4*R2C[10] -> 1800 | C7: =RC4*R2C[10] -> 2025 | D7: =exp公式!R2C6*((RC[-3])^3)+exp公式!R2C7*((RC[-3])^2)+exp公式!R2C8*((RC[-3]))+exp公式!R2C9 -> 2250 | E7: =RC4*R2C[10] -> 2700 | F7: =RC4*R2C[10] -> 3150 | G7: =RC4*R2C[10] -> 3600
A8: 6 | B8: =RC4*R2C[10] -> 2520 | C8: =RC4*R2C[10] -> 2835 | D8: =exp公式!R2C6*((RC[-3])^3)+exp公式!R2C7*((RC[-3])^2)+exp公式!R2C8*((RC[-3]))+exp公式!R2C9 -> 3150 | E8: =RC4*R2C[10] -> 3780 | F8: =RC4*R2C[10] -> 4410 | G8: =RC4*R2C[10] -> 5040
A9: 7 | B9: =RC4*R2C[10] -> 3360 | C9: =RC4*R2C[10] -> 3780 | D9: =exp公式!R2C6*((RC[-3])^3)+exp公式!R2C7*((RC[-3])^2)+exp公式!R2C8*((RC[-3]))+exp公式!R2C9 -> 4200 | E9: =RC4*R2C[10] -> 5040 | F9: =RC4*R2C[10] -> 5880 | G9: =RC4*R2C[10] -> 6720
A10: 8 | B10: =RC4*R2C[10] -> 4320 | C10: =RC4*R2C[10] -> 4860 | D10: =exp公式!R2C6*((RC[-3])^3)+exp公式!R2C7*((RC[-3])^2)+exp公式!R2C8*((RC[-3]))+exp公式!R2C9 -> 5400 | E10: =RC4*R2C[10] -> 6480 | F10: =RC4*R2C[10] -> 7559.9999999999991 | G10: =RC4*R2C[10] -> 8640
A11: 9 | B11: =RC4*R2C[10] -> 5400 | C11: =RC4*R2C[10] -> 6075 | D11: =exp公式!R2C6*((RC[-3])^3)+exp公式!R2C7*((RC[-3])^2)+exp公式!R2C8*((RC[-3]))+exp公式!R2C9 -> 6750 | E11: =RC4*R2C[10] -> 8100 | F11: =RC4*R2C[10] -> 9450 | G11: =RC4*R2C[10] -> 10800
A12: 10 | B12: =RC4*R2C[10] -> 6600 | C12: =RC4*R2C[10] -> 7425 | D12: =exp公式!R2C6*((RC[-3])^3)+exp公式!R2C7*((RC[-3])^2)+exp公式!R2C8*((RC[-3]))+exp公式!R2C9 -> 8250 | E12: =RC4*R2C[10] -> 9900 | F12: =RC4*R2C[10] -> 11550 | G12: =RC4*R2C[10] -> 13200
A13: 11 | B13: =RC4*R2C[10] -> 7920 | C13: =RC4*R2C[10] -> 8910 | D13: =exp公式!R2C6*((RC[-3])^3)+exp公式!R2C7*((RC[-3])^2)+exp公式!R2C8*((RC[-3]))+exp公式!R2C9 -> 9900 | E13: =RC4*R2C[10] -> 11880 | F13: =RC4*R2C[10] -> 13860 | G13: =RC4*R2C[10] -> 15840
A14: 12 | B14: =RC4*R2C[10] -> 9360 | C14: =RC4*R2C[10] -> 10530 | D14: =exp公式!R2C6*((RC[-3])^3)+exp公式!R2C7*((RC[-3])^2)+exp公式!R2C8*((RC[-3]))+exp公式!R2C9 -> 11700 | E14: =RC4*R2C[10] -> 14040 | F14: =RC4*R2C[10] -> 16379.999999999998 | G14: =RC4*R2C[10] -> 18720
A15: 13 | B15: =RC4*R2C[10] -> 10920 | C15: =RC4*R2C[10] -> 12285 | D15: =exp公式!R2C6*((RC[-3])^3)+exp公式!R2C7*((RC[-3])^2)+exp公式!R2C8*((RC[-3]))+exp公式!R2C9 -> 13650 | E15: =RC4*R2C[10] -> 16380 | F15: =RC4*R2C[10] -> 19110 | G15: =RC4*R2C[10] -> 21840
A16: 14 | B16: =RC4*R2C[10] -> 12600 | C16: =RC4*R2C[10] -> 14175 | D16: =exp公式!R2C6*((RC[-3])^3)+exp公式!R2C7*((RC[-3])^2)+exp公式!R2C8*((RC[-3]))+exp公式!R2C9 -> 15750 | E16: =RC4*R2C[10] -> 18900 | F16: =RC4*R2C[10] -> 22050 | G16: =RC4*R2C[10] -> 25200
A17: 15 | B17: =RC4*R2C[10] -> 14400 | C17: =RC4*R2C[10] -> 16200 | D17: =exp公式!R2C6*((RC[-3])^3)+exp公式!R2C7*((RC[-3])^2)+exp公式!R2C8*((RC[-3]))+exp公式!R2C9 -> 18000 | E17: =RC4*R2C[10] -> 21600 | F17: =RC4*R2C[10] -> 25200 | G17: =RC4*R2C[10] -> 28800
A18: 16 | B18: =RC4*R2C[10] -> 16320 | C18: =RC4*R2C[10] -> 18360 | D18: =exp公式!R2C6*((RC[-3])^3)+exp公式!R2C7*((RC[-3])^2)+exp公式!R2C8*((RC[-3]))+exp公式!R2C9 -> 20400 | E18: =RC4*R2C[10] -> 24480 | F18: =RC4*R2C[10] -> 28560 | G18: =RC4*R2C[10] -> 32640
A19: 17 | B19: =RC4*R2C[10] -> 18360 | C19: =RC4*R2C[10] -> 20655 | D19: =exp公式!R2C6*((RC[-3])^3)+exp公式!R2C7*((RC[-3])^2)+exp公式!R2C8*((RC[-3]))+exp公式!R2C9 -> 22950 | E19: =RC4*R2C[10] -> 27540 | F19: =RC4*R2C[10] -> 32129.999999999996 | G19: =RC4*R2C[10] -> 36720
A20: 18 | B20: =RC4*R2C[10] -> 20520 | C20: =RC4*R2C[10] -> 23085 | D20: =exp公式!R2C6*((RC[-3])^3)+exp公式!R2C7*((RC[-3])^2)+exp公式!R2C8*((RC[-3]))+exp公式!R2C9 -> 25650 | E20: =RC4*R2C[10] -> 30780 | F20: =RC4*R2C[10] -> 35910 | G20: =RC4*R2C[10] -> 41040
A21: 19 | B21: =RC4*R2C[10] -> 22800 | C21: =RC4*R2C[10] -> 25650 | D21: =exp公式!R2C6*((RC[-3])^3)+exp公式!R2C7*((RC[-3])^2)+exp公式!R2C8*((RC[-3]))+exp公式!R2C9 -> 28500 | E21: =RC4*R2C[10] -> 34200 | F21: =RC4*R2C[10] -> 39900 | G21: =RC4*R2C[10] -> 45600
A22: 20 | B22: =RC4*R2C[10] -> 25200 | C22: =RC4*R2C[10] -> 28350 | D22: =exp公式!R2C6*((RC[-3])^3)+exp公式!R2C7*((RC[-3])^2)+exp公式!R2C8*((RC[-3]))+exp公式!R2C9 -> 31500 | E22: =RC4*R2C[10] -> 37800 | F22: =RC4*R2C[10] -> 44100 | G22: =RC4*R2C[10] -> 50400
A23: 21 | B23: =RC4*R2C[10] -> 27720 | C23: =RC4*R2C[10] -> 31185 | D23: =exp公式!R2C6*((RC[-3])^3)+exp公式!R2C7*((RC[-3])^2)+exp公式!R2C8*((RC[-3]))+exp公式!R2C9 -> 34650 | E23: =RC4*R2C[10] -> 41580 | F23: =RC4*R2C[10] -> 48510 | G23: =RC4*R2C[10] -> 55440
A24: 22 | B24: =RC4*R2C[10] -> 30360 | C24: =RC4*R2C[10] -> 34155 | D24: =exp公式!R2C6*((RC[-3])^3)+exp公式!R2C7*((RC[-3])^2)+exp公式!R2C8*((RC[-3]))+exp公式!R2C9 -> 37950 | E24: =RC4*R2C[10] -> 45540 | F24: =RC4*R2C[10] -> 53130 | G24: =RC4*R2C[10] -> 60720
A25: 23 | B25: =RC4*R2C[10] -> 33120 | C25: =RC4*R2C[10] -> 37260 | D25: =exp公式!R2C6*((RC[-3])^3)+exp公式!R2C7*((RC[-3])^2)+exp公式!R2C8*((RC[-3]))+exp公式!R2C9 -> 41400 | E25: =RC4*R2C[10] -> 49680 | F25: =RC4*R2C[10] -> 57959.999999999993 | G25: =RC4*R2C[10] -> 66240
A26: 24 | B26: =RC4*R2C[10] -> 36000 | C26: =RC4*R2C[10] -> 40500 | D26: =exp公式!R2C6*((RC[-3])^3)+exp公式!R2C7*((RC[-3])^2)+exp公式!R2C8*((RC[-3]))+exp公式!R2C9 -> 45000 | E26: =RC4*R2C[10] -> 54000 | F26: =RC4*R2C[10] -> 62999.999999999993 | G26: =RC4*R2C[10] -> 72000
A27: 25 | B27: =RC4*R2C[10] -> 39000 | C27: =RC4*R2C[10] -> 43875 | D27: =exp公式!R2C6*((RC[-3])^3)+exp公式!R2C7*((RC[-3])^2)+exp公式!R2C8*((RC[-3]))+exp公式!R2C9 -> 48750 | E27: =RC4*R2C[10] -> 58500 | F27: =RC4*R2C[10] -> 68250 | G27: =RC4*R2C[10] -> 78000
A28: 26 | B28: =RC4*R2C[10] -> 42120 | C28: =RC4*R2C[10] -> 47385 | D28: =exp公式!R2C6*((RC[-3])^3)+exp公式!R2C7*((RC[-3])^2)+exp公式!R2C8*((RC[-3]))+exp公式!R2C9 -> 52650 | E28: =RC4*R2C[10] -> 63180 | F28: =RC4*R2C[10] -> 73710 | G28: =RC4*R2C[10] -> 84240
A29: 27 | B29: =RC4*R2C[10] -> 45360 | C29: =RC4*R2C[10] -> 51030 | D29: =exp公式!R2C6*((RC[-3])^3)+exp公式!R2C7*((RC[-3])^2)+exp公式!R2C8*((RC[-3]))+exp公式!R2C9 -> 56700 | E29: =RC4*R2C[10] -> 68040 | F29: =RC4*R2C[10] -> 79380 | G29: =RC4*R2C[10] -> 90720
A30: 28 | B30: =RC4*R2C[10] -> 48720 | C30: =RC4*R2C[10] -> 54810 | D30: =exp公式!R2C6*((RC[-3])^3)+exp公式!R2C7*((RC[-3])^2)+exp公式!R2C8*((RC[-3]))+exp公式!R2C9 -> 60900 | E30: =RC4*R2C[10] -> 73080 | F30: =RC4*R2C[10] -> 85260 | G30: =RC4*R2C[10] -> 97440
A31: 29 | B31: =RC4*R2C[10] -> 52200 | C31: =RC4*R2C[10] -> 58725 | D31: =exp公式!R2C6*((RC[-3])^3)+exp公式!R2C7*((RC[-3])^2)+exp公式!R2C8*((RC[-3]))+exp公式!R2C9 -> 65250 | E31: =RC4*R2C[10] -> 78300 | F31: =RC4*R2C[10] -> 91350 | G31: =RC4*R2C[10] -> 104400
A32: 30 | B32: =RC4*R2C[10] -> 55800 | C32: =RC4*R2C[10] -> 62775 | D32: =exp公式!R2C6*((RC[-3])^3)+exp公式!R2C7*((RC[-3])^2)+exp公式!R2C8*((RC[-3]))+exp公式!R2C9 -> 69750 | E32: =RC4*R2C[10] -> 83700 | F32: =RC4*R2C[10] -> 97650 | G32: =RC4*R2C[10] -> 111600
A33: 31 | B33: =RC4*R2C[10] -> 59520 | C33: =RC4*R2C[10] -> 66960 | D33: =exp公式!R2C6*((RC[-3])^3)+exp公式!R2C7*((RC[-3])^2)+exp公式!R2C8*((RC[-3]))+exp公式!R2C9 -> 74400 | E33: =RC4*R2C[10] -> 89280 | F33: =RC4*R2C[10] -> 104160 | G33: =RC4*R2C[10] -> 119040
A34: 32 | B34: =RC4*R2C[10] -> 63360 | C34: =RC4*R2C[10] -> 71280 | D34: =exp公式!R2C6*((RC[-3])^3)+exp公式!R2C7*((RC[-3])^2)+exp公式!R2C8*((RC[-3]))+exp公式!R2C9 -> 79200 | E34: =RC4*R2C[10] -> 95040 | F34: =RC4*R2C[10] -> 110880 | G34: =RC4*R2C[10] -> 126720
A35: 33 | B35: =RC4*R2C[10] -> 67320 | C35: =RC4*R2C[10] -> 75735 | D35: =exp公式!R2C6*((RC[-3])^3)+exp公式!R2C7*((RC[-3])^2)+exp公式!R2C8*((RC[-3]))+exp公式!R2C9 -> 84150 | E35: =RC4*R2C[10] -> 100980 | F35: =RC4*R2C[10] -> 117809.99999999999 | G35: =RC4*R2C[10] -> 134640
A36: 34 | B36: =RC4*R2C[10] -> 71400 | C36: =RC4*R2C[10] -> 80325 | D36: =exp公式!R2C6*((RC[-3])^3)+exp公式!R2C7*((RC[-3])^2)+exp公式!R2C8*((RC[-3]))+exp公式!R2C9 -> 89250 | E36: =RC4*R2C[10] -> 107100 | F36: =RC4*R2C[10] -> 124949.99999999999 | G36: =RC4*R2C[10] -> 142800
A37: 35 | B37: =RC4*R2C[10] -> 75600 | C37: =RC4*R2C[10] -> 85050 | D37: =exp公式!R2C6*((RC[-3])^3)+exp公式!R2C7*((RC[-3])^2)+exp公式!R2C8*((RC[-3]))+exp公式!R2C9 -> 94500 | E37: =RC4*R2C[10] -> 113400 | F37: =RC4*R2C[10] -> 132300 | G37: =RC4*R2C[10] -> 151200
A38: 36 | B38: =RC4*R2C[10] -> 79920 | C38: =RC4*R2C[10] -> 89910 | D38: =exp公式!R2C6*((RC[-3])^3)+exp公式!R2C7*((RC[-3])^2)+exp公式!R2C8*((RC[-3]))+exp公式!R2C9 -> 99900 | E38: =RC4*R2C[10] -> 119880 | F38: =RC4*R2C[10] -> 139860 | G38: =RC4*R2C[10] -> 159840
A39: 37 | B39: =RC4*R2C[10] -> 84360 | C39: =RC4*R2C[10] -> 94905 | D39: =exp公式!R2C6*((RC[-3])^3)+exp公式!R2C7*((RC[-3])^2)+exp公式!R2C8*((RC[-3]))+exp公式!R2C9 -> 105450 | E39: =RC4*R2C[10] -> 126540 | F39: =RC4*R2C[10] -> 147630 | G39: =RC4*R2C[10] -> 168720
A40: 38 | B40: =RC4*R2C[10] -> 88920 | C40: =RC4*R2C[10] -> 100035 | D40: =exp公式!R2C6*((RC[-3])^3)+exp公式!R2C7*((RC[-3])^2)+exp公式!R2C8*((RC[-3]))+exp公式!R2C9 -> 111150 | E40: =RC4*R2C[10] -> 133380 | F40: =RC4*R2C[10] -> 155610 | G40: =RC4*R2C[10] -> 177840
A41: 39 | B41: =RC4*R2C[10] -> 93600 | C41: =RC4*R2C[10] -> 105300 | D41: =exp公式!R2C6*((RC[-3])^3)+exp公式!R2C7*((RC[-3])^2)+exp公式!R2C8*((RC[-3]))+exp公式!R2C9 -> 117000 | E41: =RC4*R2C[10] -> 140400 | F41: =RC4*R2C[10] -> 163800 | G41: =RC4*R2C[10] -> 187200
A42: 40 | B42: =RC4*R2C[10] -> 98400 | C42: =RC4*R2C[10] -> 110700 | D42: =exp公式!R2C6*((RC[-3])^3)+exp公式!R2C7*((RC[-3])^2)+exp公式!R2C8*((RC[-3]))+exp公式!R2C9 -> 123000 | E42: =RC4*R2C[10] -> 147600 | F42: =RC4*R2C[10] -> 172200 | G42: =RC4*R2C[10] -> 196800
A43: 41 | B43: =RC4*R2C[10] -> 103320 | C43: =RC4*R2C[10] -> 116235 | D43: =exp公式!R2C6*((RC[-3])^3)+exp公式!R2C7*((RC[-3])^2)+exp公式!R2C8*((RC[-3]))+exp公式!R2C9 -> 129150 | E43: =RC4*R2C[10] -> 154980 | F43: =RC4*R2C[10] -> 180810 | G43: =RC4*R2C[10] -> 206640
A44: 42 | B44: =RC4*R2C[10] -> 108360 | C44: =RC4*R2C[10] -> 121905 | D44: =exp公式!R2C6*((RC[-3])^3)+exp公式!R2C7*((RC[-3])^2)+exp公式!R2C8*((RC[-3]))+exp公式!R2C9 -> 135450 | E44: =RC4*R2C[10] -> 162540 | F44: =RC4*R2C[10] -> 189630 | G44: =RC4*R2C[10] -> 216720
A45: 43 | B45: =RC4*R2C[10] -> 113520 | C45: =RC4*R2C[10] -> 127710 | D45: =exp公式!R2C6*((RC[-3])^3)+exp公式!R2C7*((RC[-3])^2)+exp公式!R2C8*((RC[-3]))+exp公式!R2C9 -> 141900 | E45: =RC4*R2C[10] -> 170280 | F45: =RC4*R2C[10] -> 198660 | G45: =RC4*R2C[10] -> 227040
A46: 44 | B46: =RC4*R2C[10] -> 118800 | C46: =RC4*R2C[10] -> 133650 | D46: =exp公式!R2C6*((RC[-3])^3)+exp公式!R2C7*((RC[-3])^2)+exp公式!R2C8*((RC[-3]))+exp公式!R2C9 -> 148500 | E46: =RC4*R2C[10] -> 178200 | F46: =RC4*R2C[10] -> 207900 | G46: =RC4*R2C[10] -> 237600
A47: 45 | B47: =RC4*R2C[10] -> 124200 | C47: =RC4*R2C[10] -> 139725 | D47: =exp公式!R2C6*((RC[-3])^3)+exp公式!R2C7*((RC[-3])^2)+exp公式!R2C8*((RC[-3]))+exp公式!R2C9 -> 155250 | E47: =RC4*R2C[10] -> 186300 | F47: =RC4*R2C[10] -> 217350 | G47: =RC4*R2C[10] -> 248400
A48: 46 | B48: =RC4*R2C[10] -> 129720 | C48: =RC4*R2C[10] -> 145935 | D48: =exp公式!R2C6*((RC[-3])^3)+exp公式!R2C7*((RC[-3])^2)+exp公式!R2C8*((RC[-3]))+exp公式!R2C9 -> 162150 | E48: =RC4*R2C[10] -> 194580 | F48: =RC4*R2C[10] -> 227010 | G48: =RC4*R2C[10] -> 259440
A49: 47 | B49: =RC4*R2C[10] -> 135360 | C49: =RC4*R2C[10] -> 152280 | D49: =exp公式!R2C6*((RC[-3])^3)+exp公式!R2C7*((RC[-3])^2)+exp公式!R2C8*((RC[-3]))+exp公式!R2C9 -> 169200 | E49: =RC4*R2C[10] -> 203040 | F49: =RC4*R2C[10] -> 236879.99999999997 | G49: =RC4*R2C[10] -> 270720
A50: 48 | B50: =RC4*R2C[10] -> 141120 | C50: =RC4*R2C[10] -> 158760 | D50: =exp公式!R2C6*((RC[-3])^3)+exp公式!R2C7*((RC[-3])^2)+exp公式!R2C8*((RC[-3]))+exp公式!R2C9 -> 176400 | E50: =RC4*R2C[10] -> 211680 | F50: =RC4*R2C[10] -> 246959.99999999997 | G50: =RC4*R2C[10] -> 282240
A51: 49 | B51: =RC4*R2C[10] -> 147000 | C51: =RC4*R2C[10] -> 165375 | D51: =exp公式!R2C6*((RC[-3])^3)+exp公式!R2C7*((RC[-3])^2)+exp公式!R2C8*((RC[-3]))+exp公式!R2C9 -> 183750 | E51: =RC4*R2C[10] -> 220500 | F51: =RC4*R2C[10] -> 257249.99999999997 | G51: =RC4*R2C[10] -> 294000
A52: 50 | B52: =RC4*R2C[10] -> 153000 | C52: =RC4*R2C[10] -> 172125 | D52: =exp公式!R2C6*((RC[-3])^3)+exp公式!R2C7*((RC[-3])^2)+exp公式!R2C8*((RC[-3]))+exp公式!R2C9 -> 191250 | E52: =RC4*R2C[10] -> 229500 | F52: =RC4*R2C[10] -> 267750 | G52: =RC4*R2C[10] -> 306000
A53: 51 | B53: =RC4*R2C[10] -> 159120 | C53: =RC4*R2C[10] -> 179010 | D53: =exp公式!R2C6*((RC[-3])^3)+exp公式!R2C7*((RC[-3])^2)+exp公式!R2C8*((RC[-3]))+exp公式!R2C9 -> 198900 | E53: =RC4*R2C[10] -> 238680 | F53: =RC4*R2C[10] -> 278460 | G53: =RC4*R2C[10] -> 318240
A54: 52 | B54: =RC4*R2C[10] -> 165360 | C54: =RC4*R2C[10] -> 186030 | D54: =exp公式!R2C6*((RC[-3])^3)+exp公式!R2C7*((RC[-3])^2)+exp公式!R2C8*((RC[-3]))+exp公式!R2C9 -> 206700 | E54: =RC4*R2C[10] -> 248040 | F54: =RC4*R2C[10] -> 289380 | G54: =RC4*R2C[10] -> 330720
A55: 53 | B55: =RC4*R2C[10] -> 171720 | C55: =RC4*R2C[10] -> 193185 | D55: =exp公式!R2C6*((RC[-3])^3)+exp公式!R2C7*((RC[-3])^2)+exp公式!R2C8*((RC[-3]))+exp公式!R2C9 -> 214650 | E55: =RC4*R2C[10] -> 257580 | F55: =RC4*R2C[10] -> 300510 | G55: =RC4*R2C[10] -> 343440
A56: 54 | B56: =RC4*R2C[10] -> 178200 | C56: =RC4*R2C[10] -> 200475 | D56: =exp公式!R2C6*((RC[-3])^3)+exp公式!R2C7*((RC[-3])^2)+exp公式!R2C8*((RC[-3]))+exp公式!R2C9 -> 222750 | E56: =RC4*R2C[10] -> 267300 | F56: =RC4*R2C[10] -> 311850 | G56: =RC4*R2C[10] -> 356400
A57: 55 | B57: =RC4*R2C[10] -> 184800 | C57: =RC4*R2C[10] -> 207900 | D57: =exp公式!R2C6*((RC[-3])^3)+exp公式!R2C7*((RC[-3])^2)+exp公式!R2C8*((RC[-3]))+exp公式!R2C9 -> 231000 | E57: =RC4*R2C[10] -> 277200 | F57: =RC4*R2C[10] -> 323400 | G57: =RC4*R2C[10] -> 369600
A58: 56 | B58: =RC4*R2C[10] -> 191520 | C58: =RC4*R2C[10] -> 215460 | D58: =exp公式!R2C6*((RC[-3])^3)+exp公式!R2C7*((RC[-3])^2)+exp公式!R2C8*((RC[-3]))+exp公式!R2C9 -> 239400 | E58: =RC4*R2C[10] -> 287280 | F58: =RC4*R2C[10] -> 335160 | G58: =RC4*R2C[10] -> 383040
A59: 57 | B59: =RC4*R2C[10] -> 198360 | C59: =RC4*R2C[10] -> 223155 | D59: =exp公式!R2C6*((RC[-3])^3)+exp公式!R2C7*((RC[-3])^2)+exp公式!R2C8*((RC[-3]))+exp公式!R2C9 -> 247950 | E59: =RC4*R2C[10] -> 297540 | F59: =RC4*R2C[10] -> 347130 | G59: =RC4*R2C[10] -> 396720
A60: 58 | B60: =RC4*R2C[10] -> 205320 | C60: =RC4*R2C[10] -> 230985 | D60: =exp公式!R2C6*((RC[-3])^3)+exp公式!R2C7*((RC[-3])^2)+exp公式!R2C8*((RC[-3]))+exp公式!R2C9 -> 256650 | E60: =RC4*R2C[10] -> 307980 | F60: =RC4*R2C[10] -> 359310 | G60: =RC4*R2C[10] -> 410640
A61: 59 | B61: =RC4*R2C[10] -> 212400 | C61: =RC4*R2C[10] -> 238950 | D61: =exp公式!R2C6*((RC[-3])^3)+exp公式!R2C7*((RC[-3])^2)+exp公式!R2C8*((RC[-3]))+exp公式!R2C9 -> 265500 | E61: =RC4*R2C[10] -> 318600 | F61: =RC4*R2C[10] -> 371700 | G61: =RC4*R2C[10] -> 424800
A62: 60 | B62: =RC4*R2C[10] -> 219600 | C62: =RC4*R2C[10] -> 247050 | D62: =exp公式!R2C6*((RC[-3])^3)+exp公式!R2C7*((RC[-3])^2)+exp公式!R2C8*((RC[-3]))+exp公式!R2C9 -> 274500 | E62: =RC4*R2C[10] -> 329400 | F62: =RC4*R2C[10] -> 384300 | G62: =RC4*R2C[10] -> 439200
A63: 61 | B63: =RC4*R2C[10] -> 226920 | C63: =RC4*R2C[10] -> 255285 | D63: =exp公式!R2C6*((RC[-3])^3)+exp公式!R2C7*((RC[-3])^2)+exp公式!R2C8*((RC[-3]))+exp公式!R2C9 -> 283650 | E63: =RC4*R2C[10] -> 340380 | F63: =RC4*R2C[10] -> 397110 | G63: =RC4*R2C[10] -> 453840
A64: 62 | B64: =RC4*R2C[10] -> 234360 | C64: =RC4*R2C[10] -> 263655 | D64: =exp公式!R2C6*((RC[-3])^3)+exp公式!R2C7*((RC[-3])^2)+exp公式!R2C8*((RC[-3]))+exp公式!R2C9 -> 292950 | E64: =RC4*R2C[10] -> 351540 | F64: =RC4*R2C[10] -> 410130 | G64: =RC4*R2C[10] -> 468720
A65: 63 | B65: =RC4*R2C[10] -> 241920 | C65: =RC4*R2C[10] -> 272160 | D65: =exp公式!R2C6*((RC[-3])^3)+exp公式!R2C7*((RC[-3])^2)+exp公式!R2C8*((RC[-3]))+exp公式!R2C9 -> 302400 | E65: =RC4*R2C[10] -> 362880 | F65: =RC4*R2C[10] -> 423360 | G65: =RC4*R2C[10] -> 483840
A66: 64 | B66: =RC4*R2C[10] -> 249600 | C66: =RC4*R2C[10] -> 280800 | D66: =exp公式!R2C6*((RC[-3])^3)+exp公式!R2C7*((RC[-3])^2)+exp公式!R2C8*((RC[-3]))+exp公式!R2C9 -> 312000 | E66: =RC4*R2C[10] -> 374400 | F66: =RC4*R2C[10] -> 436800 | G66: =RC4*R2C[10] -> 499200
A67: 65 | B67: =RC4*R2C[10] -> 257400 | C67: =RC4*R2C[10] -> 289575 | D67: =exp公式!R2C6*((RC[-3])^3)+exp公式!R2C7*((RC[-3])^2)+exp公式!R2C8*((RC[-3]))+exp公式!R2C9 -> 321750 | E67: =RC4*R2C[10] -> 386100 | F67: =RC4*R2C[10] -> 450450 | G67: =RC4*R2C[10] -> 514800
A68: 66 | B68: =RC4*R2C[10] -> 265320 | C68: =RC4*R2C[10] -> 298485 | D68: =exp公式!R2C6*((RC[-3])^3)+exp公式!R2C7*((RC[-3])^2)+exp公式!R2C8*((RC[-3]))+exp公式!R2C9 -> 331650 | E68: =RC4*R2C[10] -> 397980 | F68: =RC4*R2C[10] -> 464309.99999999994 | G68: =RC4*R2C[10] -> 530640
A69: 67 | B69: =RC4*R2C[10] -> 273360 | C69: =RC4*R2C[10] -> 307530 | D69: =exp公式!R2C6*((RC[-3])^3)+exp公式!R2C7*((RC[-3])^2)+exp公式!R2C8*((RC[-3]))+exp公式!R2C9 -> 341700 | E69: =RC4*R2C[10] -> 410040 | F69: =RC4*R2C[10] -> 478379.99999999994 | G69: =RC4*R2C[10] -> 546720
A70: 68 | B70: =RC4*R2C[10] -> 281520 | C70: =RC4*R2C[10] -> 316710 | D70: =exp公式!R2C6*((RC[-3])^3)+exp公式!R2C7*((RC[-3])^2)+exp公式!R2C8*((RC[-3]))+exp公式!R2C9 -> 351900 | E70: =RC4*R2C[10] -> 422280 | F70: =RC4*R2C[10] -> 492659.99999999994 | G70: =RC4*R2C[10] -> 563040
A71: 69 | B71: =RC4*R2C[10] -> 289800 | C71: =RC4*R2C[10] -> 326025 | D71: =exp公式!R2C6*((RC[-3])^3)+exp公式!R2C7*((RC[-3])^2)+exp公式!R2C8*((RC[-3]))+exp公式!R2C9 -> 362250 | E71: =RC4*R2C[10] -> 434700 | F71: =RC4*R2C[10] -> 507149.99999999994 | G71: =RC4*R2C[10] -> 579600
A72: 70 | B72: =RC4*R2C[10] -> 298200 | C72: =RC4*R2C[10] -> 335475 | D72: =exp公式!R2C6*((RC[-3])^3)+exp公式!R2C7*((RC[-3])^2)+exp公式!R2C8*((RC[-3]))+exp公式!R2C9 -> 372750 | E72: =RC4*R2C[10] -> 447300 | F72: =RC4*R2C[10] -> 521849.99999999994 | G72: =RC4*R2C[10] -> 596400
A73: 71 | B73: =RC4*R2C[10] -> 306720 | C73: =RC4*R2C[10] -> 345060 | D73: =exp公式!R2C6*((RC[-3])^3)+exp公式!R2C7*((RC[-3])^2)+exp公式!R2C8*((RC[-3]))+exp公式!R2C9 -> 383400 | E73: =RC4*R2C[10] -> 460080 | F73: =RC4*R2C[10] -> 536760 | G73: =RC4*R2C[10] -> 613440
A74: 72 | B74: =RC4*R2C[10] -> 315360 | C74: =RC4*R2C[10] -> 354780 | D74: =exp公式!R2C6*((RC[-3])^3)+exp公式!R2C7*((RC[-3])^2)+exp公式!R2C8*((RC[-3]))+exp公式!R2C9 -> 394200 | E74: =RC4*R2C[10] -> 473040 | F74: =RC4*R2C[10] -> 551880 | G74: =RC4*R2C[10] -> 630720
A75: 73 | B75: =RC4*R2C[10] -> 324120 | C75: =RC4*R2C[10] -> 364635 | D75: =exp公式!R2C6*((RC[-3])^3)+exp公式!R2C7*((RC[-3])^2)+exp公式!R2C8*((RC[-3]))+exp公式!R2C9 -> 405150 | E75: =RC4*R2C[10] -> 486180 | F75: =RC4*R2C[10] -> 567210 | G75: =RC4*R2C[10] -> 648240
A76: 74 | B76: =RC4*R2C[10] -> 333000 | C76: =RC4*R2C[10] -> 374625 | D76: =exp公式!R2C6*((RC[-3])^3)+exp公式!R2C7*((RC[-3])^2)+exp公式!R2C8*((RC[-3]))+exp公式!R2C9 -> 416250 | E76: =RC4*R2C[10] -> 499500 | F76: =RC4*R2C[10] -> 582750 | G76: =RC4*R2C[10] -> 666000
A77: 75 | B77: =RC4*R2C[10] -> 342000 | C77: =RC4*R2C[10] -> 384750 | D77: =exp公式!R2C6*((RC[-3])^3)+exp公式!R2C7*((RC[-3])^2)+exp公式!R2C8*((RC[-3]))+exp公式!R2C9 -> 427500 | E77: =RC4*R2C[10] -> 513000 | F77: =RC4*R2C[10] -> 598500 | G77: =RC4*R2C[10] -> 684000
A78: 76 | B78: =RC4*R2C[10] -> 351120 | C78: =RC4*R2C[10] -> 395010 | D78: =exp公式!R2C6*((RC[-3])^3)+exp公式!R2C7*((RC[-3])^2)+exp公式!R2C8*((RC[-3]))+exp公式!R2C9 -> 438900 | E78: =RC4*R2C[10] -> 526680 | F78: =RC4*R2C[10] -> 614460 | G78: =RC4*R2C[10] -> 702240
A79: 77 | B79: =RC4*R2C[10] -> 360360 | C79: =RC4*R2C[10] -> 405405 | D79: =exp公式!R2C6*((RC[-3])^3)+exp公式!R2C7*((RC[-3])^2)+exp公式!R2C8*((RC[-3]))+exp公式!R2C9 -> 450450 | E79: =RC4*R2C[10] -> 540540 | F79: =RC4*R2C[10] -> 630630 | G79: =RC4*R2C[10] -> 720720
A80: 78 | B80: =RC4*R2C[10] -> 369720 | C80: =RC4*R2C[10] -> 415935 | D80: =exp公式!R2C6*((RC[-3])^3)+exp公式!R2C7*((RC[-3])^2)+exp公式!R2C8*((RC[-3]))+exp公式!R2C9 -> 462150 | E80: =RC4*R2C[10] -> 554580 | F80: =RC4*R2C[10] -> 647010 | G80: =RC4*R2C[10] -> 739440
A81: 79 | B81: =RC4*R2C[10] -> 379200 | C81: =RC4*R2C[10] -> 426600 | D81: =exp公式!R2C6*((RC[-3])^3)+exp公式!R2C7*((RC[-3])^2)+exp公式!R2C8*((RC[-3]))+exp公式!R2C9 -> 474000 | E81: =RC4*R2C[10] -> 568800 | F81: =RC4*R2C[10] -> 663600 | G81: =RC4*R2C[10] -> 758400

Sheet: exp公式
B1: 等级 | C1: 需要经验
F2: 0 | G2: 75 | H2: 75 | I2: 0
B3: 1 | C3: 150 | E3: 1 | F3: =R2C6*((RC[-1])^3)+R2C7*((RC[-1])^2)+R2C8*((RC[-1]))+R2C9 -> 150
B4: 2 | C4: 450 | E4: 10 | F4: =R2C6*((RC[-1])^3)+R2C7*((RC[-1])^2)+R2C8*((RC[-1]))+R2C9 -> 8250 | G4: =(RC[-1]-R[-1]C[-1])/R[-1]C[-1] -> 54
B5: 3 | C5: 900 | E5: 20 | F5: =R2C6*((RC[-1])^3)+R2C7*((RC[-1])^2)+R2C8*((RC[-1]))+R2C9 -> 31500 | G5: =(RC[-1]-R[-1]C[-1])/R[-1]C[-1] -> 2.8181818181818183
B6: 4 | C6: 1500 | E6: 30 | F6: =R2C6*((RC[-1])^3)+R2C7*((RC[-1])^2)+R2C8*((RC[-1]))+R2C9 -> 69750 | G6: =(RC[-1]-R[-1]C[-1])/R[-1]C[-1] -> 1.2142857142857142
B7: 20 | C7: 31500 | E7: 40 | F7: =R2C6*((RC[-1])^3)+R2C7*((RC[-1])^2)+R2C8*((RC[-1]))+R2C9 -> 123000 | G7: =(RC[-1]-R[-1]C[-1])/R[-1]C[-1] -> 0.76344086021505375
B8: 40 | C8: 123000 | E8: 50 | F8: =R2C6*((RC[-1])^3)+R2C7*((RC[-1])^2)+R2C8*((RC[-1]))+R2C9 -> 191250 | G8: =(RC[-1]-R[-1]C[-1])/R[-1]C[-1] -> 0.55487804878048785
E9: 60 | F9: =R2C6*((RC[-1])^3)+R2C7*((RC[-1])^2)+R2C8*((RC[-1]))+R2C9 -> 274500 | G9: =(RC[-1]-R[-1]C[-1])/R[-1]C[-1] -> 0.43529411764705883
E10: 70 | F10: =R2C6*((RC[-1])^3)+R2C7*((RC[-1])^2)+R2C8*((RC[-1]))+R2C9 -> 372750 | G10: =(RC[-1]-R[-1]C[-1])/R[-1]C[-1] -> 0.35792349726775957
E11: 80 | F11: =R2C6*((RC[-1])^3)+R2C7*((RC[-1])^2)+R2C8*((RC[-1]))+R2C9 -> 486000 | G11: =(RC[-1]-R[-1]C[-1])/R[-1]C[-1] -> 0.30382293762575452
E12: 90 | F12: =R2C6*((RC[-1])^3)+R2C7*((RC[-1])^2)+R2C8*((RC[-1]))+R2C9 -> 614250 | G12: =(RC[-1]-R[-1]C[-1])/R[-1]C[-1] -> 0.2638888888888889
F21: 43.088999999999999 | G21: 0.80469999999999997
E22: 10 | F22: =R21C6*EXP(R21C7*RC[-1]) -> 134627.60228050768
E23: 15 | F23: =R21C6*EXP(R21C7*RC[-1]) -> 7525198.4783947943 | G23: =(RC[-1]-R[-1]C[-1])/R[-1]C[-1] -> 54.896401264841842
E24: 20 | F24: =R21C6*EXP(R21C7*RC[-1]) -> 420631513.74593425 | G24: =(RC[-1]-R[-1]C[-1])/R[-1]C[-1] -> 54.896401264842048
E25: 30 | F25: =R21C6*EXP(R21C7*RC[-1]) -> 1314224329625.5503 | G25: =(RC[-1]-R[-1]C[-1])/R[-1]C[-1] -> 3123.4076743602132
E26: 40 | F26: =R21C6*EXP(R21C7*RC[-1]) -> 4106172581313005.5 | G26: =(RC[-1]-R[-1]C[-1])/R[-1]C[-1] -> 3123.4076743602359
E27: 50 | F27: =R21C6*EXP(R21C7*RC[-1]) -> 1.282935712530184E+19 | G27: =(RC[-1]-R[-1]C[-1])/R[-1]C[-1] -> 3123.4076743602132
E28: 60 | F28: =R21C6*EXP(R21C7*RC[-1]) -> 4.008414185940095E+22 | G28: =(RC[-1]-R[-1]C[-1])/R[-1]C[-1] -> 3123.4076743602136
E29: 70 | F29: =R21C6*EXP(R21C7*RC[-1]) -> 1.2523920044565668E+26 | G29: =(RC[-1]-R[-1]C[-1])/R[-1]C[-1] -> 3123.4076743602354
E30: 80 | F30: =R21C6*EXP(R21C7*RC[-1]) -> 3.9129831900314958E+29 | G30: =(RC[-1]-R[-1]C[-1])/R[-1]C[-1] -> 3123.4076743602359
E31: 90 | F31: =R21C6*EXP(R21C7*RC[-1]) -> 1.2225754708576914E+33 | G31: =(RC[-1]-R[-1]C[-1])/R[-1]C[-1] -> 3123.4076743602132