Sheet: master
A1: ID | B1: 等级 | C1: 经验 | D1: 体力上限
A2: 0 | B2: 0 | C2: 0 | D2: 120
A3: 1 | B3: 1 | C3: 100 | D3: 120
A4: 2 | B4: 2 | C4: 200 | D4: 125
A5: 3 | B5: 3 | C5: 300 | D5: 125
A6: 4 | B6: 4 | C6: 400 | D6: 130
A7: 5 | B7: 5 | C7: 600 | D7: 130
A8: 6 | B8: 6 | C8: 800 | D8: 135
A9: 7 | B9: 7 | C9: 1000 | D9: 135
A10: 8 | B10: 8 | C10: 2000 | D10: 140
A11: 9 | B11: 9 | C11: 3400 | D11: 140
A12: 10 | B12: 10 | C12: 4800 | D12: 145
A13: 11 | B13: 11 | C13: 6200 | D13: 145
A14: 12 | B14: 12 | C14: 7600 | D14: 150
A15: 13 | B15: 13 | C15: 10200 | D15: 150
A16: 14 | B16: 14 | C16: 13300 | D16: 155
A17: 15 | B17: 15 | C17: 15800 | D17: 155
A18: 16 | B18: 16 | C18: 19600 | D18: 160
A19: 17 | B19: 17 | C19: 24500 | D19: 160
A20: 18 | B20: 18 | C20: 33800 | D20: 165
A21: 19 | B21: 19 | C21: 44800 | D21: 165
A22: 20 | B22: 20 | C22: 57000 | D22: 170
A23: 21 | B23: 21 | C23: 70400 | D23: 170
A24: 22 | B24: 22 | C24: 86600 | D24: 175
A25: 23 | B25: 23 | C25: 106400 | D25: 175
A26: 24 | B26: 24 | C26: 126000 | D26: 180
A27: 25 | B27: 25 | C27: 144900 | D27: 180
A28: 26 | B28: 26 | C28: 167200 | D28: 185
A29: 27 | B29: 27 | C29: 193600 | D29: 185
A30: 28 | B30: 28 | C30: 235000 | D30: 190
A31: 29 | B31: 29 | C31: 278200 | D31: 190
A32: 30 | B32: 30 | C32: 321300 | D32: 195
A33: 31 | B33: 31 | C33: 369600 | D33: 195
A34: 32 | B34: 32 | C34: 425300 | D34: 200
A35: 33 | B35: 33 | C35: 489800 | D35: 200
A36: 34 | B36: 34 | C36: 544000 | D36: 200
A37: 35 | B37: 35 | C37: 603900 | D37: 200
A38: 36 | B38: 36 | C38: 666400 | D38: 200
A39: 37 | B39: 37 | C39: 738400 | D39: 200
A40: 38 | B40: 38 | C40: 851200 | D40: 200
A41: 39 | B41: 39 | C41: 951700 | D41: 200
A42: 40 | B42: 40 | C42: 1057300 | D42: 200
A43: 41 | B43: 41 | C43: 1168000 | D43: 200
A44: 42 | B44: 42 | C44: 1298500 | D44: 200
A45: 43 | B45: 43 | C45: 1470000 | D45: 200
A46: 44 | B46: 44 | C46: 1618400 | D46: 200
A47: 45 | B47: 45 | C47: 1773100 | D47: 200
A48: 46 | B48: 46 | C48: 1939200 | D48: 200
A49: 47 | B49: 47 | C49: 2126600 | D49: 200
A50: 48 | B50: 48 | C50: 2473800 | D50: 200
A51: 49 | B51: 49 | C51: 2768500 | D51: 200
A52: 50 | B52: 50 | C52: 3073000 | D52: 200
A53: 51 | B53: 51 | C53: 3399500 | D53: 200
A54: 52 | B54: 52 | C54: 3886500 | D54: 200
A55: 53 | B55: 53 | C55: 4337000 | D55: 200
A56: 54 | B56: 54 | C56: 4817400 | D56: 200
A57: 55 | B57: 55 | C57: 5313000 | D57: 200
A58: 56 | B58: 56 | C58: 6008900 | D58: 200
A59: 57 | B59: 57 | C59: 6673200 | D59: 200
A60: 58 | B60: 58 | C60: 7358700 | D60: 200
A61: 59 | B61: 59 | C61: 8073600 | D61: 200
A62: 60 | B62: 60 | C62: 8800300 | D62: 200
A63: 61 | B63: 61 | C63: 9592400 | D63: 200
A64: 62 | B64: 62 | C64: 10455800 | D64: 200
A65: 63 | B65: 63 | C65: 11396900 | D65: 200
A66: 64 | B66: 64 | C66: 12422700 | D66: 200
A67: 65 | B67: 65 | C67: =ROUNDUP(R[-1]C*1.09,-2) -> 13540800 | D67: 200
A68: 66 | B68: 66 | C68: =ROUNDUP(R[-1]C*1.09,-2) -> 14759500 | D68: 200
A69: 67 | B69: 67 | C69: =ROUNDUP(R[-1]C*1.09,-2) -> 16087900 | D69: 200
A70: 68 | B70: 68 | C70: =ROUNDUP(R[-1]C*1.09,-2) -> 17535900 | D70: 200
A71: 69 | B71: 69 | C71: =ROUNDUP(R[-1]C*1.09,-2) -> 19114200 | D71: 200
A72: 70 | B72: 70 | C72: =ROUNDUP(R[-1]C*1.09,-2) -> 20834500 | D72: 200
A73: 71 | B73: 71 | C73: =ROUNDUP(R[-1]C*1.09,-2) -> 22709700 | D73: 200
A74: 72 | B74: 72 | C74: =ROUNDUP(R[-1]C*1.09,-2) -> 24753600 | D74: 200
A75: 73 | B75: 73 | C75: =ROUNDUP(R[-1]C*1.09,-2) -> 26981500 | D75: 200
A76: 74 | B76: 74 | C76: =ROUNDUP(R[-1]C*1.09,-2) -> 29409900 | D76: 200
A77: 75 | B77: 75 | C77: =ROUNDUP(R[-1]C*1.09,-2) -> 32056800 | D77: 200
A78: 76 | B78: 76 | C78: =ROUNDUP(R[-1]C*1.09,-2) -> 34942000 | D78: 200
A79: 77 | B79: 77 | C79: =ROUNDUP(R[-1]C*1.09,-2) -> 38086800 | D79: 200
A80: 78 | B80: 78 | C80: =ROUNDUP(R[-1]C*1.09,-2) -> 41514700 | D80: 200
A81: 79 | B81: 79 | C81: =ROUNDUP(R[-1]C*1.09,-2) -> 45251100 | D81: 200